{
  "schema_version": "1.0.0",
  "id": "skill.web.accessibility",
  "title": "Accessibilità applicativa",
  "aliases": [],
  "domain": "web",
  "description": "Portare la base a tastiera, focus, ARIA e regressioni automatizzate su UI asincrona.",
  "ssri_coverage": {
    "level": "C2",
    "evidence_ids": [
      "ev.ssri.web"
    ]
  },
  "ironmath_requirement": {
    "level": "M3",
    "evidence_ids": [
      "ev.ironmath.web-test"
    ]
  },
  "priority": "P1",
  "primary_course_id": "EAT-007",
  "roadmap_taxonomy": [
    "Frontend",
    "QA"
  ],
  "status": "planned",
  "gap": {
    "confidence": "medium",
    "note": "Portare la base a tastiera, focus, ARIA e regressioni automatizzate su UI asincrona."
  }
}
