{
  "schema_version": "1.0.0",
  "id": "skill.typescript.language",
  "title": "TypeScript e contratti",
  "aliases": [],
  "domain": "typescript",
  "description": "I tipi Java non equivalgono a narrowing, generics TS e validazione runtime con Zod.",
  "ssri_coverage": {
    "level": "C0",
    "evidence_ids": [
      "ev.ssri.absence-typescript.language",
      "ev.ssri.absence-operational-ecosystem"
    ]
  },
  "ironmath_requirement": {
    "level": "M3",
    "evidence_ids": [
      "ev.ironmath.api"
    ]
  },
  "priority": "P0",
  "primary_course_id": "EAT-005",
  "roadmap_taxonomy": [
    "TypeScript"
  ],
  "status": "planned",
  "gap": {
    "confidence": "medium",
    "note": "I tipi Java non equivalgono a narrowing, generics TS e validazione runtime con Zod."
  }
}
