{
  "schema_version": "1.0.0",
  "id": "skill.js.fundamentals",
  "title": "JavaScript moderno",
  "aliases": [],
  "domain": "js",
  "description": "Rendere solida la semantica JS per leggere codice applicativo e diagnosticare coercizione e closure.",
  "ssri_coverage": {
    "level": "C2",
    "evidence_ids": [
      "ev.ssri.js"
    ]
  },
  "ironmath_requirement": {
    "level": "M3",
    "evidence_ids": [
      "ev.ironmath.web"
    ]
  },
  "priority": "P0",
  "primary_course_id": "EAT-003",
  "roadmap_taxonomy": [
    "JavaScript"
  ],
  "status": "planned",
  "gap": {
    "confidence": "medium",
    "note": "Rendere solida la semantica JS per leggere codice applicativo e diagnosticare coercizione e closure."
  }
}
