{
  "schema_version": "1.0.0",
  "id": "skill.privacy.minors-retention-secrets",
  "title": "Privacy, minori e retention",
  "aliases": [],
  "domain": "privacy",
  "description": "La base privacy richiede minimizzazione, delete, retention e secret discipline nel ciclo operativo.",
  "ssri_coverage": {
    "level": "C2",
    "evidence_ids": [
      "ev.ssri.governance"
    ]
  },
  "ironmath_requirement": {
    "level": "M3",
    "evidence_ids": [
      "ev.ironmath.bible"
    ]
  },
  "priority": "P1",
  "primary_course_id": "EAT-010",
  "roadmap_taxonomy": [
    "Cyber Security",
    "DevSecOps"
  ],
  "status": "planned",
  "gap": {
    "confidence": "medium",
    "note": "La base privacy richiede minimizzazione, delete, retention e secret discipline nel ciclo operativo."
  }
}
