{
  "schema_version": "1.0.0",
  "id": "skill.docs.markdown-latex",
  "title": "Markdown, LaTeX e docs verificabili",
  "aliases": [],
  "domain": "docs",
  "description": "Leggere appunti non dimostra gestione di sorgente, renderer, link e freshness.",
  "ssri_coverage": {
    "level": "C1",
    "evidence_ids": [
      "ev.ssri.readme"
    ]
  },
  "ironmath_requirement": {
    "level": "M3",
    "evidence_ids": [
      "ev.ironmath.bible"
    ]
  },
  "priority": "P0",
  "primary_course_id": "EAT-001",
  "roadmap_taxonomy": [
    "Technical Writer"
  ],
  "status": "planned",
  "gap": {
    "confidence": "medium",
    "note": "Leggere appunti non dimostra gestione di sorgente, renderer, link e freshness."
  }
}
