{
  "schema_version": "1.0.0",
  "id": "skill.sre.backup-incident-retention",
  "title": "Backup, incident e retention",
  "aliases": [],
  "domain": "sre",
  "description": "La governance non dimostra restore drill, incident runbook e purge verificabile.",
  "ssri_coverage": {
    "level": "C1",
    "evidence_ids": [
      "ev.ssri.governance"
    ]
  },
  "ironmath_requirement": {
    "level": "M3",
    "evidence_ids": [
      "ev.ironmath.status"
    ]
  },
  "priority": "P1",
  "primary_course_id": "EAT-015",
  "roadmap_taxonomy": [
    "DevOps",
    "Data Engineer"
  ],
  "status": "planned",
  "gap": {
    "confidence": "medium",
    "note": "La governance non dimostra restore drill, incident runbook e purge verificabile."
  }
}
