{
  "schema_version": "1.0.0",
  "id": "skill.cloud.railway",
  "title": "Railway operativo",
  "aliases": [],
  "domain": "cloud",
  "description": "Mancano servizi, health, migration gate e recovery nel target Railway.",
  "ssri_coverage": {
    "level": "C0",
    "evidence_ids": [
      "ev.ssri.absence-cloud.railway",
      "ev.ssri.absence-operational-ecosystem"
    ]
  },
  "ironmath_requirement": {
    "level": "M3",
    "evidence_ids": [
      "ev.ironmath.status"
    ]
  },
  "priority": "P1",
  "primary_course_id": "EAT-014",
  "roadmap_taxonomy": [
    "DevOps"
  ],
  "status": "planned",
  "gap": {
    "confidence": "medium",
    "note": "Mancano servizi, health, migration gate e recovery nel target Railway."
  }
}
