{
  "schema_version": "1.0.0",
  "id": "skill.sre.observability",
  "title": "Osservabilità",
  "aliases": [],
  "domain": "sre",
  "description": "Log concettuali non dimostrano structured log, metriche, SLI/SLO e alert sanitizzati.",
  "ssri_coverage": {
    "level": "C1",
    "evidence_ids": [
      "ev.ssri.pss-devops"
    ]
  },
  "ironmath_requirement": {
    "level": "M3",
    "evidence_ids": [
      "ev.ironmath.python-map"
    ]
  },
  "priority": "P1",
  "primary_course_id": "EAT-015",
  "roadmap_taxonomy": [
    "DevOps"
  ],
  "status": "planned",
  "gap": {
    "confidence": "medium",
    "note": "Log concettuali non dimostrano structured log, metriche, SLI/SLO e alert sanitizzati."
  }
}
